{
  "$schema": "https://json-schema.org/draft/2020-12/schema",
  "$id": "https://style.dev/schema/index.schema.json",
  "title": "STYLE runtime index",
  "type": "object",
  "required": ["format", "style_version", "packages", "static", "harnesses"],
  "additionalProperties": false,
  "allOf": [{"if": {"properties": {"format": {"const": 1}}}, "then": {"properties": {"harnesses": {"additionalProperties": {"additionalProperties": {"items": {"not": {"required": ["refresh"]}}}}}}}}, {"if": {"properties": {"format": {"enum": [1, 2]}}}, "then": {"properties": {"harnesses": {"additionalProperties": {"additionalProperties": {"items": {"properties": {"body": {"$ref": "#/$defs/legacyBody"}, "model_body": {"$ref": "#/$defs/legacyBody"}}}}}}}}}, {"if": {"properties": {"format": {"enum": [1, 2, 3]}}}, "then": {"properties": {"harnesses": {"additionalProperties": {"additionalProperties": {"items": {"properties": {"when": {"not": {"required": ["provider"]}}, "needs": {"not": {"contains": {"const": "provider"}}}, "body": {"$ref": "#/$defs/preProviderBody"}, "model_body": {"$ref": "#/$defs/preProviderBody"}}}}}}}}}, {"if": {"properties": {"format": {"enum": [1, 2, 3, 4]}}}, "then": {"properties": {"harnesses": {"additionalProperties": {"additionalProperties": {"items": {"properties": {"when": {"properties": {"model": {"not": {"contains": {"pattern": "^[uU][nN][kK][nN][oO][wW][nN]$"}}}, "provider": {"not": {"contains": {"const": "unknown"}}}, "thinking_effort": {"not": {"contains": {"pattern": "^\\s*[uU][nN][kK][nN][oO][wW][nN]\\s*$"}}}, "harness": {"properties": {"permission_mode": {"not": {"contains": {"const": "unknown"}}}}}}}}}}}}}}}, {"if": {"properties": {"format": {"enum": [1, 2, 3, 4, 5]}}}, "then": {"not": {"required": ["effort_mapping"]}}}],
  "properties": {
    "format": {"enum": [1, 2, 3, 4, 5, 6]},
    "effort_mapping": {"type": "object", "minProperties": 1, "propertyNames": {"pattern": "^[a-z0-9][a-z0-9_.-]{0,63}$"}, "additionalProperties": {"type": "object", "minProperties": 1, "maxProperties": 128, "propertyNames": {"pattern": "^[a-z0-9][a-z0-9_.-]{0,63}$"}, "additionalProperties": {"enum": ["none", "minimal", "low", "medium", "high", "xhigh", "max", "open"]}}},
    "style_version": {"type": "string", "minLength": 1},
    "packages": {
      "type": "array",
      "items": {"$ref": "#/$defs/package"}
    },
    "static": {
      "type": "object",
      "additionalProperties": {
        "type": "array",
        "items": {"$ref": "#/$defs/staticEntry"}
      }
    },
    "harnesses": {
      "type": "object",
      "propertyNames": {"minLength": 1},
      "additionalProperties": {"$ref": "#/$defs/harness"}
    }
  },
  "$defs": {
    "sha256": {
      "type": "string",
      "pattern": "^sha256:[0-9a-f]{64}$"
    },
    "package": {
      "type": "object",
      "required": ["name", "version", "seq", "lock", "link"],
      "additionalProperties": false,
      "properties": {
        "name": {"type": "string", "minLength": 1},
        "version": {"type": "string", "minLength": 1},
        "seq": {"type": "integer", "minimum": 1},
        "lock": {"$ref": "#/$defs/sha256"},
        "link": {"type": "boolean"}
      }
    },
    "estimate": {
      "type": "object",
      "required": ["tokens", "chars"],
      "additionalProperties": false,
      "properties": {
        "tokens": {"type": "integer", "minimum": 0},
        "chars": {"type": "integer", "minimum": 0}
      }
    },
    "staticEntry": {
      "type": "object",
      "required": ["rule", "slot", "src", "body_sha256", "est"],
      "additionalProperties": false,
      "properties": {
        "rule": {"type": "string", "minLength": 1},
        "slot": {"enum": ["developer_instructions", "model_instructions_file", "claude_md", "claude_rules"]},
        "src": {"type": "string", "minLength": 1},
        "body_sha256": {"$ref": "#/$defs/sha256"},
        "est": {"$ref": "#/$defs/estimate"}
      }
    },
    "variable": {
      "type": "object",
      "required": ["var"],
      "additionalProperties": false,
      "properties": {
        "var": {"type": "string", "pattern": "^[A-Za-z_][A-Za-z0-9_.]*$", "anyOf": [{"not": {"pattern": "^event\\."}}, {"pattern": "^event\\.(prompt|tool\\.(name|input(\\.[A-Za-z0-9_]+)*|added|output)|mcp\\.(server|tool)|skill\\.name)$"}]},
        "default": {"type": "string"}
      }
    },
    "preProviderBody": {"allOf": [{"$ref": "#/$defs/body"}, {"properties": {"parts": {"items": {"not": {"type": "object", "required": ["var"], "properties": {"var": {"const": "provider"}}}}}}}]},
    "legacyBody": {"allOf": [{"$ref": "#/$defs/body"}, {"properties": {"parts": {"items": {"not": {"type": "object", "required": ["var"], "properties": {"var": {"pattern": "^event\\."}}}}}}}]},
    "body": {
      "oneOf": [
        {
          "type": "object",
          "required": ["static"],
          "additionalProperties": false,
          "properties": {"static": {"type": "string"}}
        },
        {
          "type": "object",
          "required": ["parts"],
          "additionalProperties": false,
          "properties": {
            "parts": {
              "type": "array",
              "items": {"oneOf": [{"type": "string"}, {"$ref": "#/$defs/variable"}]}
            }
          }
        }
      ]
    },
    "condition": {
      "type": "object",
      "required": ["field", "op", "pattern"],
      "additionalProperties": false,
      "properties": {
        "field": {"type": "string", "minLength": 1},
        "op": {"enum": ["regex", "shell_regex", "contains", "equals", "not_contains", "starts_with", "ends_with"]},
        "pattern": {"type": "string"}
      }
    },
    "when": {
      "type": "object",
      "required": ["agent", "thinking_effort_approx"],
      "additionalProperties": false,
      "properties": {
        "model": {"type": "array", "items": {"type": "string"}},
        "provider": {"type": "array", "items": {"type": "string", "pattern": "^[A-Za-z0-9][A-Za-z0-9_.-]{0,63}$"}},
        "thinking_effort": {"type": "array", "items": {"type": "string"}},
        "thinking_effort_approx": {"type": ["boolean", "null"]},
        "harness": {
          "type": "object",
          "additionalProperties": false,
          "properties": {
            "name": {"type": "array", "items": {"enum": ["codex", "claude-code"]}},
            "permission_mode": {"type": "array", "items": {"type": "string"}}
          }
        },
        "agent": {"type": "array", "minItems": 1, "items": {"type": "string", "minLength": 1}},
        "conditions": {"type": "array", "items": {"$ref": "#/$defs/condition"}}
      }
    },
    "selector": {
      "type": "string",
      "minLength": 1,
      "pattern": "^([^\\s].*[^\\s]|[^\\s])$"
    },
    "match": {
      "type": "object",
      "minProperties": 1,
      "additionalProperties": false,
      "properties": {
        "canonical": {"type": "array", "minItems": 1, "items": {"$ref": "#/$defs/selector"}},
        "names": {"type": "array", "minItems": 1, "items": {"$ref": "#/$defs/selector"}},
        "mcp": {
          "type": "array",
          "minItems": 1,
          "items": {
            "type": "object",
            "required": ["server", "tool"],
            "additionalProperties": false,
            "properties": {
              "server": {"$ref": "#/$defs/selector", "pattern": "^[^/]+$"},
              "tool": {"$ref": "#/$defs/selector", "pattern": "^[^/]+$"}
            }
          }
        },
        "skill": {"type": "array", "minItems": 1, "items": {"$ref": "#/$defs/selector"}}
      }
    },
    "order": {
      "type": "array",
      "minItems": 3,
      "maxItems": 3,
      "prefixItems": [
        {"type": "number"},
        {"type": "integer", "minimum": 1},
        {"type": "integer", "minimum": 0}
      ],
      "items": false
    },
    "entry": {
      "type": "object",
      "required": [
        "rule", "entry", "src", "src_sha256", "body_sha256", "order", "target", "action",
        "when", "repeat", "reinject_on_compact", "needs", "body", "est", "degraded_from"
      ],
      "additionalProperties": false,
      "properties": {
        "rule": {"type": "string", "minLength": 1},
        "entry": {"type": "string", "minLength": 1},
        "src": {"type": "string", "minLength": 1},
        "src_sha256": {"$ref": "#/$defs/sha256"},
        "body_sha256": {"$ref": "#/$defs/sha256"},
        "order": {"$ref": "#/$defs/order"},
        "target": {"enum": ["system", "event", "tool", "mcp", "skill"]},
        "action": {"enum": ["inject", "warn", "block"]},
        "match": {"$ref": "#/$defs/match"},
        "when": {"$ref": "#/$defs/when"},
        "repeat": {"enum": ["every", "turn", "session"]},
        "refresh": {"type": "integer", "minimum": 1, "maximum": 1000000},
        "reinject_on_compact": {"type": "boolean"},
        "sources": {"type": "array", "items": {"type": "string"}},
        "reeval": {"type": "boolean"},
        "needs": {"type": "array", "items": {"type": "string"}, "uniqueItems": true},
        "body": {"$ref": "#/$defs/body"},
        "model_body": {"$ref": "#/$defs/body"},
        "model_body_first_sentence": {"type": "boolean"},
        "est": {"$ref": "#/$defs/estimate"},
        "degraded_from": {"type": ["string", "null"]}
      },
      "allOf": [
        {
          "if": {"properties": {"action": {"const": "warn"}}, "required": ["action"]},
          "then": {"required": ["model_body"]},
          "else": {"not": {"required": ["model_body"]}}
        },
        {
          "if": {
            "properties": {"model_body_first_sentence": {"const": true}},
            "required": ["model_body_first_sentence"]
          },
          "then": {
            "required": ["model_body"],
            "properties": {"action": {"const": "warn"}}
          }
        }
      ]
    },
    "entryWithMatch": {
      "allOf": [
        {"$ref": "#/$defs/entry"},
        {"required": ["match"]},
        {"not": {"required": ["sources"]}}
      ]
    },
    "routedToolEntry": {
      "allOf": [
        {"$ref": "#/$defs/entryWithMatch"}
      ],
      "oneOf": [
        {
          "properties": {
            "target": {"const": "tool"},
            "match": {
              "allOf": [
                {"$ref": "#/$defs/match"},
                {"anyOf": [{"required": ["canonical"]}, {"required": ["names"]}]},
                {"not": {"anyOf": [{"required": ["mcp"]}, {"required": ["skill"]}]}}
              ]
            }
          },
          "required": ["target", "match"]
        },
        {
          "properties": {
            "target": {"const": "mcp"},
            "match": {
              "allOf": [
                {"$ref": "#/$defs/match"},
                {"required": ["mcp"]},
                {"not": {"anyOf": [{"required": ["canonical"]}, {"required": ["names"]}, {"required": ["skill"]}]}}
              ]
            }
          },
          "required": ["target", "match"]
        },
        {
          "properties": {
            "target": {"const": "skill"},
            "match": {
              "allOf": [
                {"$ref": "#/$defs/match"},
                {"required": ["skill"]},
                {"not": {"anyOf": [{"required": ["canonical"]}, {"required": ["names"]}, {"required": ["mcp"]}]}}
              ]
            }
          },
          "required": ["target", "match"]
        }
      ]
    },
    "eventToolEntry": {
      "allOf": [
        {"$ref": "#/$defs/entry"},
        {"properties": {"target": {"const": "event"}}, "required": ["target"]},
        {"not": {"anyOf": [{"required": ["match"]}, {"required": ["sources"]}]}}
      ]
    },
    "toolHookEntry": {
      "oneOf": [
        {"$ref": "#/$defs/routedToolEntry"},
        {"$ref": "#/$defs/eventToolEntry"}
      ]
    },
    "entryWithoutMatchOrSources": {
      "allOf": [
        {"$ref": "#/$defs/entry"},
        {"not": {"anyOf": [{"required": ["match"]}, {"required": ["sources"]}]}}
      ]
    },
    "sessionEntry": {
      "allOf": [
        {"$ref": "#/$defs/entry"},
        {"properties": {"target": {"enum": ["system", "event"]}}, "required": ["target"]},
        {"required": ["sources"]},
        {"not": {"required": ["match"]}}
      ]
    },
    "promptEntry": {
      "allOf": [
        {"$ref": "#/$defs/entryWithoutMatchOrSources"},
        {"properties": {"target": {"enum": ["system", "event"]}}, "required": ["target"]}
      ]
    },
    "explicitSkillEntry": {
      "allOf": [
        {"$ref": "#/$defs/entryWithMatch"},
        {"properties": {"target": {"const": "skill"}}, "required": ["target"]}
      ]
    },
    "harness": {
      "type": "object",
      "additionalProperties": false,
      "properties": {
        "session.start": {"type": "array", "items": {"$ref": "#/$defs/sessionEntry"}},
        "prompt.submitted": {"type": "array", "items": {"$ref": "#/$defs/promptEntry"}},
        "skill.explicit": {"type": "array", "items": {"$ref": "#/$defs/explicitSkillEntry"}},
        "tool.pre": {"type": "array", "items": {"$ref": "#/$defs/toolHookEntry"}},
        "tool.post": {"type": "array", "items": {"$ref": "#/$defs/toolHookEntry"}},
        "tool.error": {"type": "array", "items": {"$ref": "#/$defs/toolHookEntry"}},
        "subagent.start": {"type": "array", "items": {"$ref": "#/$defs/entryWithoutMatchOrSources"}}
      }
    }
  }
}
